<!-- Crea un fichero XSD que valide el siguiente XML --> 
<hotel xmlns:xsi="http://www.w3.org/2001/XMLSchema-instance" 
xsi:noNamespaceSchemaLocation="hotelTransilvania.xsd">
    <personaje nombre="Cleopatra">
        <poder>No envejece</poder>
        <poder>Transforma en animales</poder>
        <poder>RÃ¡pido</poder>
        <debilidad>Ajo</debilidad>
        <debilidad>Sol</debilidad>
        <debilidad>Estaca</debilidad>
    </personaje>
</hotel>